{
  "$schema": "https://json-schema.org/draft/2020-12/schema",
  "title": "TirePressureTechnology",
  "type": "object",
  "required": ["pageMeta", "technologyTracks", "accuracyBands", "testMethods", "certificationStandards"],
  "properties": {
    "pageMeta": {
      "type": "object",
      "required": ["conclusion", "evidence", "risk", "visualizationSuggestion", "updatedAt", "sources", "confidence", "publishStatus", "lastReviewedAt", "dataMethod"],
      "properties": {
        "conclusion": { "type": "string" },
        "evidence": { "type": "string" },
        "risk": { "type": "string" },
        "visualizationSuggestion": { "type": "string" },
        "updatedAt": { "type": "string", "format": "date" },
        "sources": { "type": "array", "minItems": 1, "items": { "type": "object", "required": ["id", "sourceType", "sourceTitle", "sourceUrl", "quotedAt", "note"], "properties": { "id": { "type": "string" }, "sourceType": { "enum": ["official", "government-relay", "industry-association", "marketplace", "commodity-tracker", "research"] }, "sourceTitle": { "type": "string" }, "sourceUrl": { "type": "string", "format": "uri" }, "quotedAt": { "type": "string", "format": "date" }, "note": { "type": "string" } }, "additionalProperties": false } },
        "confidence": { "enum": ["high", "medium", "low"] },
        "publishStatus": { "enum": ["draft", "reviewed", "published", "needs_review"] },
        "lastReviewedAt": { "type": "string", "format": "date" },
        "dataMethod": { "type": "string" }
      },
      "additionalProperties": false
    },
    "technologyTracks": {
      "type": "array",
      "minItems": 1,
      "items": {
        "type": "object",
        "required": ["title", "maturity", "differentiator", "application", "applicableRegion", "standardConstraint", "sources", "confidence", "publishStatus", "lastReviewedAt", "dataMethod"],
        "properties": {
          "title": { "type": "string" },
          "maturity": { "enum": ["成熟", "成长", "前瞻"] },
          "differentiator": { "type": "string" },
          "application": { "type": "string" },
          "applicableRegion": { "type": "string" },
          "standardConstraint": { "type": "string" },
          "sources": { "type": "array", "minItems": 1, "items": { "type": "object", "required": ["id", "sourceType", "sourceTitle", "sourceUrl", "quotedAt", "note"], "properties": { "id": { "type": "string" }, "sourceType": { "enum": ["official", "government-relay", "industry-association", "marketplace", "commodity-tracker", "research"] }, "sourceTitle": { "type": "string" }, "sourceUrl": { "type": "string", "format": "uri" }, "quotedAt": { "type": "string", "format": "date" }, "note": { "type": "string" } }, "additionalProperties": false } },
          "confidence": { "enum": ["high", "medium", "low"] },
          "publishStatus": { "enum": ["draft", "reviewed", "published", "needs_review"] },
          "lastReviewedAt": { "type": "string", "format": "date" },
          "dataMethod": { "type": "string" }
        },
        "additionalProperties": false
      }
    },
    "accuracyBands": {
      "type": "array",
      "minItems": 1,
      "items": {
        "type": "object",
        "required": ["grade", "tolerance", "scenario", "risk", "sources", "confidence", "publishStatus", "lastReviewedAt", "dataMethod"],
        "properties": {
          "grade": { "type": "string" },
          "tolerance": { "type": "string" },
          "scenario": { "type": "string" },
          "risk": { "type": "string" },
          "sources": { "type": "array", "minItems": 1, "items": { "type": "object", "required": ["id", "sourceType", "sourceTitle", "sourceUrl", "quotedAt", "note"], "properties": { "id": { "type": "string" }, "sourceType": { "enum": ["official", "government-relay", "industry-association", "marketplace", "commodity-tracker", "research"] }, "sourceTitle": { "type": "string" }, "sourceUrl": { "type": "string", "format": "uri" }, "quotedAt": { "type": "string", "format": "date" }, "note": { "type": "string" } }, "additionalProperties": false } },
          "confidence": { "enum": ["high", "medium", "low"] },
          "publishStatus": { "enum": ["draft", "reviewed", "published", "needs_review"] },
          "lastReviewedAt": { "type": "string", "format": "date" },
          "dataMethod": { "type": "string" }
        },
        "additionalProperties": false
      }
    },
    "testMethods": {
      "type": "array",
      "minItems": 1,
      "items": {
        "type": "object",
        "required": ["name", "purpose", "keyCheckpoints", "linkedProcess", "sources", "confidence", "publishStatus", "lastReviewedAt", "dataMethod"],
        "properties": {
          "name": { "type": "string" },
          "purpose": { "type": "string" },
          "keyCheckpoints": { "type": "array", "items": { "type": "string" }, "minItems": 1 },
          "linkedProcess": { "type": "string" },
          "sources": { "type": "array", "minItems": 1, "items": { "type": "object", "required": ["id", "sourceType", "sourceTitle", "sourceUrl", "quotedAt", "note"], "properties": { "id": { "type": "string" }, "sourceType": { "enum": ["official", "government-relay", "industry-association", "marketplace", "commodity-tracker", "research"] }, "sourceTitle": { "type": "string" }, "sourceUrl": { "type": "string", "format": "uri" }, "quotedAt": { "type": "string", "format": "date" }, "note": { "type": "string" } }, "additionalProperties": false } },
          "confidence": { "enum": ["high", "medium", "low"] },
          "publishStatus": { "enum": ["draft", "reviewed", "published", "needs_review"] },
          "lastReviewedAt": { "type": "string", "format": "date" },
          "dataMethod": { "type": "string" }
        },
        "additionalProperties": false
      }
    },
    "certificationStandards": {
      "type": "array",
      "minItems": 1,
      "items": {
        "type": "object",
        "required": ["name", "scope", "region", "applicableProduct", "implication", "sources", "confidence", "publishStatus", "lastReviewedAt", "dataMethod"],
        "properties": {
          "name": { "type": "string" },
          "scope": { "type": "string" },
          "region": { "type": "string" },
          "applicableProduct": { "type": "string" },
          "implication": { "type": "string" },
          "sources": { "type": "array", "minItems": 1, "items": { "type": "object", "required": ["id", "sourceType", "sourceTitle", "sourceUrl", "quotedAt", "note"], "properties": { "id": { "type": "string" }, "sourceType": { "enum": ["official", "government-relay", "industry-association", "marketplace", "commodity-tracker", "research"] }, "sourceTitle": { "type": "string" }, "sourceUrl": { "type": "string", "format": "uri" }, "quotedAt": { "type": "string", "format": "date" }, "note": { "type": "string" } }, "additionalProperties": false } },
          "confidence": { "enum": ["high", "medium", "low"] },
          "publishStatus": { "enum": ["draft", "reviewed", "published", "needs_review"] },
          "lastReviewedAt": { "type": "string", "format": "date" },
          "dataMethod": { "type": "string" }
        },
        "additionalProperties": false
      }
    }
  },
  "additionalProperties": false
}
